{
  "$schema": "./UNI_MANIFEST_RECONCILIATION_G15_B_SCHEMA.json",
  "schema_version": "G15-B-manifest-reconciliation",
  "reconciliation_id": "G15-B-manifest-reconciliation",
  "metadata_only": true,
  "observed_at": "2026-10-18",
  "base_commit": "8567297743ea5e4c94c1c0b6a0f18c7886ebc6fc",
  "scope": {
    "input_report_range": "G5-G14",
    "expected_report_ids": [
      "G5",
      "G6",
      "G7",
      "G8",
      "G9",
      "G10",
      "G11",
      "G12",
      "G13",
      "G14"
    ],
    "available_report_ids": [
      "G5",
      "G6",
      "G7",
      "G9",
      "G10",
      "G11",
      "G12",
      "G13",
      "G14"
    ],
    "missing_report_ids": [
      "G8"
    ],
    "current_checkout_only": true,
    "matching_policy": "Only explicit record keys, manifest paths, exact path+SHA-256 identity, and explicit manifest scope.package are admissible.",
    "deduplication_policy": "Exact path+SHA-256 aliases remain separate representations; no deduplication is performed.",
    "semantic_matching_policy": "Course names, titles, topics, COURSE.yaml fonti, text similarity, and presumed subject correspondence are not matching bases.",
    "promotion_policy": "Licence, evidence, vigency, legal clearance, and claim-ready state are copied or blocked conservatively; no state is promoted by this reconciliation.",
    "excluded_payloads": [
      "PDF, XML, HTML, manuals, standards, prices, manufacturer data, and source text",
      "COURSE.yaml content beyond report-provided pack identifiers and paths",
      "schede JSONL, exam questions, answers, and solutions",
      "live URL requests and independent legal or technical review"
    ]
  },
  "summary": {
    "input_report_count": 10,
    "available_report_count": 9,
    "missing_report_count": 1,
    "manifest_count": 5,
    "record_count": 34,
    "alias_group_count": 14,
    "record_rows_with_aliases": 28,
    "record_rows_with_open_remediation": 34,
    "pack_count": 71,
    "pack_rows_with_exact_manifest_scope": 1,
    "g14_blocked_pack_count": 70,
    "claim_ready_record_count": 0
  },
  "input_reports": [
    {
      "report_id": "G5",
      "path": "docs/coordination/UNI_CORPUS_LOTTO_G5_ECFR.json",
      "kind": "manifest",
      "collection": "source_records",
      "present": true,
      "schema_version": "G5-source-metadata",
      "artifact_id": "G5-ECFR-OSHA-1926",
      "observed_at": "2026-10-18",
      "item_count": 1,
      "status": "available"
    },
    {
      "report_id": "G6",
      "path": "docs/coordination/UNI_PROVENANCE_AUDIT_G6.json",
      "kind": "report",
      "collection": "records",
      "present": true,
      "schema_version": "G6-provenance-audit",
      "artifact_id": "G6-B-provenance",
      "observed_at": "2026-10-18",
      "item_count": 33,
      "status": "available"
    },
    {
      "report_id": "G7",
      "path": "docs/coordination/UNI_REMEDIATION_QUEUE_G7_B.json",
      "kind": "report",
      "collection": "items",
      "present": true,
      "schema_version": "G7-B-remediation-queue",
      "artifact_id": "G7-B-provenance-remediation",
      "observed_at": "2026-10-18",
      "item_count": 48,
      "status": "available"
    },
    {
      "report_id": "G8",
      "path": "docs/coordination/UNI_COMPLETENESS_LEDGER_G8.json",
      "kind": "report",
      "collection": "ledger",
      "present": false,
      "schema_version": null,
      "artifact_id": null,
      "observed_at": null,
      "item_count": 0,
      "status": "missing_in_checkout",
      "absence_reason": "Report G8 is not present in the requested checkout at the G15-B base."
    },
    {
      "report_id": "G9",
      "path": "docs/coordination/UNI_CLAIM_COVERAGE_G9_B.json",
      "kind": "report",
      "collection": "records",
      "present": true,
      "schema_version": "G9-B-claim-coverage",
      "artifact_id": "G9-B-claim-coverage",
      "observed_at": "2026-10-18",
      "item_count": 33,
      "status": "available"
    },
    {
      "report_id": "G10",
      "path": "docs/coordination/UNI_CORPUS_LOTTO_G10_B.json",
      "kind": "manifest",
      "collection": "source_records",
      "present": true,
      "schema_version": "G10-B-source-metadata",
      "artifact_id": "G10-B-EU-EPBD-2024-1275",
      "observed_at": "2026-10-18",
      "item_count": 1,
      "status": "available"
    },
    {
      "report_id": "G11",
      "path": "docs/coordination/UNI_EVIDENCE_LICENSE_MATRIX_G11_B.json",
      "kind": "report",
      "collection": "rows",
      "present": true,
      "schema_version": "G11-B-evidence-license-matrix",
      "artifact_id": "G11-B-evidence-license",
      "observed_at": "2026-10-18",
      "item_count": 2,
      "status": "available"
    },
    {
      "report_id": "G12",
      "path": "docs/coordination/UNI_LOCATOR_LICENSE_CHECKLIST_G12_B.json",
      "kind": "report",
      "collection": "records",
      "present": true,
      "schema_version": "G12-B-locator-license-checklist",
      "artifact_id": "G12-B-locator-license",
      "observed_at": "2026-10-18",
      "item_count": 2,
      "status": "available"
    },
    {
      "report_id": "G13",
      "path": "docs/coordination/UNI_PACK_PROVENANCE_COVERAGE_G13_B.json",
      "kind": "report",
      "collection": "packs",
      "present": true,
      "schema_version": "G13-B-pack-provenance-coverage",
      "artifact_id": "G13-B-pack-provenance-coverage",
      "observed_at": "2026-10-18",
      "item_count": 71,
      "status": "available"
    },
    {
      "report_id": "G14",
      "path": "docs/coordination/UNI_PACK_EVIDENCE_QUEUE_G14_B.json",
      "kind": "report",
      "collection": "items",
      "present": true,
      "schema_version": "G14-B-pack-evidence-queue",
      "artifact_id": "G14-B-pack-evidence-queue",
      "observed_at": "2026-10-18",
      "item_count": 70,
      "status": "available"
    }
  ],
  "manifest_inventory": [
    {
      "manifest_path": "Fondamenti_Pack/PROVENANCE_MANIFEST_G2.json",
      "manifest_id": "G2-FONDAMENTI-PACK-G1-PROVENANCE",
      "schema_version": "G2-package-metadata",
      "metadata_only": true,
      "record_container": "records",
      "record_count": 14,
      "declared_package_scope": null,
      "package_scope_status": "not_declared",
      "package_scope_basis": "not_declared",
      "scope_root": null
    },
    {
      "manifest_path": "UNIVERSITA_EDILIZIA/ENERGETICA_INCENTIVI_PACK/fonti/PROVENANCE_MANIFEST_G3_GSE_CT3.json",
      "manifest_id": "G3-2-ENERGETICA-GSE-CT3",
      "schema_version": "G3-source-metadata",
      "metadata_only": true,
      "record_container": "records",
      "record_count": 2,
      "declared_package_scope": "UNIVERSITA_EDILIZIA/ENERGETICA_INCENTIVI_PACK",
      "package_scope_status": "declared",
      "package_scope_basis": "manifest.scope.package",
      "scope_root": "UNIVERSITA_EDILIZIA/ENERGETICA_INCENTIVI_PACK/fonti/Regole_Applicative_CT_3_0_GSE.pdf"
    },
    {
      "manifest_path": "docs/coordination/UNI_CORPUS_LOTTO_G1.json",
      "manifest_id": "G1-FONDAMENTI-GUTENBERG-RAW",
      "schema_version": "G1",
      "metadata_only": null,
      "record_container": "records",
      "record_count": 14,
      "declared_package_scope": null,
      "package_scope_status": "not_declared",
      "package_scope_basis": "not_declared",
      "scope_root": "Fondamenti_Pack/raw/gutenberg"
    },
    {
      "manifest_path": "docs/coordination/UNI_CORPUS_LOTTO_G10_B.json",
      "manifest_id": "G10-B-EU-EPBD-2024-1275",
      "schema_version": "G10-B-source-metadata",
      "metadata_only": true,
      "record_container": "source_records",
      "record_count": 1,
      "declared_package_scope": "docs/coordination",
      "package_scope_status": "declared",
      "package_scope_basis": "manifest.scope.package",
      "scope_root": null
    },
    {
      "manifest_path": "docs/coordination/UNI_CORPUS_LOTTO_G5_ECFR.json",
      "manifest_id": "G5-ECFR-OSHA-1926",
      "schema_version": "G5-source-metadata",
      "metadata_only": true,
      "record_container": "source_records",
      "record_count": 1,
      "declared_package_scope": "Edilizia_Pack",
      "package_scope_status": "declared",
      "package_scope_basis": "manifest.scope.package",
      "scope_root": "Edilizia_Pack/raw/ecfr/29CFR1926_construction.xml"
    }
  ],
  "record_reconciliation": [
    {
      "record_key": "Fondamenti_Pack/PROVENANCE_MANIFEST_G2.json#G1-001",
      "manifest_path": "Fondamenti_Pack/PROVENANCE_MANIFEST_G2.json",
      "manifest_id": "G2-FONDAMENTI-PACK-G1-PROVENANCE",
      "record_id": "G1-001",
      "record_kind": "source",
      "title": "The Nicomachean Ethics",
      "source_kind": "public_domain_work",
      "source_reports": [
        "G6",
        "G7",
        "G9"
      ],
      "path_hash": {
        "local_path": "Fondamenti_Pack/raw/gutenberg/Aristotle_Ethics_pg8438.txt",
        "path_status": "declared",
        "hash_algorithm": "SHA-256",
        "hash_sha256": "A68264A6537BB58B899ED68E25D1C7D8EA1BCB3E9544B4D1B464F74D99C3D059",
        "hash_status": "declared",
        "identity_key": "Fondamenti_Pack/raw/gutenberg/Aristotle_Ethics_pg8438.txt#A68264A6537BB58B899ED68E25D1C7D8EA1BCB3E9544B4D1B464F74D99C3D059"
      },
      "package_scope": {
        "declared": null,
        "status": "not_declared",
        "basis": "not_declared",
        "scope_root": null
      },
      "license_status": {
        "state": "declared",
        "basis": "G6.provenance_audit",
        "source_specific": null
      },
      "evidence_status": {
        "state": "observed_local",
        "basis": "G6.provenance_audit",
        "g6_proof_state": "observed_local",
        "g9_status": "observed_local",
        "g11_status": null,
        "g12_license_state": null,
        "claim_ready": false,
        "promotion": "not_promoted"
      },
      "alias_group_ids": [
        "G15-B-ALIAS-001"
      ],
      "remediation": {
        "g7_items": [
          {